resultados_qwen/comparacion_mlflow.csv

treatment,accuracy,precision_macro,recall_macro,f1_macro,f1_weighted,invalid_responses,invalid_rate,mean_latency_s,total_inferences,precision_class_0,recall_class_0,f1_class_0,precision_class_1,recall_class_1,f1_class_1,precision_class_2,recall_class_2,f1_class_2,precision_class_3,recall_class_3,f1_class_3,precision_class_4,recall_class_4,f1_class_4,precision_class_5,recall_class_5,f1_class_5,precision_class_6,recall_class_6,f1_class_6,precision_class_7,recall_class_7,f1_class_7,precision_class_8,recall_class_8,f1_class_8,precision_class_9,recall_class_9,f1_class_9,mean_otsu_threshold,mean_segmented_pct,mean_num_regions,mean_split_regions,mean_merged_regions,mean_foreground_regions,mean_background_threshold,mean_preprocessing_s,empty_masks,full_masks
original,0.282,0.24166481993953473,0.282,0.22022064979684872,0.22022064979684872,0,0.0,0.32735830139998323,1000,0.0,0.0,0.0,0.7017543859649122,0.4,0.5095541401273885,0.19083969465648856,1.0,0.32051282051282054,0.0,0.0,0.0,0.27586206896551724,0.32,0.2962962962962963,0.3103448275862069,0.27,0.2887700534759358,0.0,0.0,0.0,0.2222222222222222,0.02,0.03669724770642202,0.515625,0.66,0.5789473684210527,0.2,0.15,0.17142857142857143,,,,,,,,,,
gaussian,0.286,0.2857003083081406,0.28600000000000003,0.2224317596622102,0.22243175966221013,0,0.0,0.32566478899998763,1000,0.0,0.0,0.0,0.8222222222222222,0.37,0.5103448275862069,0.20161290322580644,1.0,0.33557046979865773,0.0,0.0,0.0,0.23853211009174313,0.26,0.24880382775119617,0.33663366336633666,0.34,0.3383084577114428,0.2222222222222222,0.02,0.03669724770642202,0.4,0.02,0.0380952380952381,0.46710526315789475,0.71,0.5634920634920635,0.1686746987951807,0.14,0.15300546448087432,,,,,,,,,,
clahe,0.31,0.25153930417049886,0.31,0.2386808057516292,0.23868080575162917,0,0.0,0.2960986305999886,1000,0.0,0.0,0.0,0.6593406593406593,0.6,0.6282722513089005,0.2403846153846154,1.0,0.3875968992248062,0.0,0.0,0.0,0.2644628099173554,0.32,0.2895927601809955,0.29411764705882354,0.3,0.297029702970297,0.14285714285714285,0.01,0.018691588785046728,0.3333333333333333,0.06,0.1016949152542373,0.422360248447205,0.68,0.5210727969348659,0.15853658536585366,0.13,0.14285714285714285,,,,,,,,,,
gaussian_otsu,0.23,0.22880040788400274,0.23000000000000004,0.16980027877957768,0.16980027877957768,0,0.0,0.3090039629000494,1000,0.1111111111111111,0.01,0.01834862385321101,0.6538461538461539,0.34,0.4473684210526316,0.19919517102615694,0.99,0.3316582914572864,0.0,0.0,0.0,0.19011406844106463,0.5,0.27548209366391185,0.3050847457627119,0.18,0.22641509433962265,0.0,0.0,0.0,0.0,0.0,0.0,0.7407407407407407,0.2,0.31496062992125984,0.08791208791208792,0.08,0.08376963350785341,86.321,5.458207702636718,9.236,,,,,,,
clahe_otsu,0.313,0.34391323160801374,0.31300000000000006,0.2471708400071994,0.2471708400071994,0,0.0,0.307992234599973,1000,0.6666666666666666,0.02,0.038834951456310676,0.6161616161616161,0.61,0.6130653266331658,0.24146341463414633,0.99,0.38823529411764707,0.0,0.0,0.0,0.25384615384615383,0.33,0.28695652173913044,0.3157894736842105,0.3,0.3076923076923077,0.16666666666666666,0.01,0.018867924528301886,0.5882352941176471,0.1,0.17094017094017094,0.36363636363636365,0.6,0.4528301886792453,0.22666666666666666,0.17,0.19428571428571428,84.996,33.58112335205078,2000.642,,,,,,,
gaussian_split_merge,0.218,0.20204410294101455,0.21800000000000003,0.1564738428718321,0.15647384287183208,0,0.0,0.29626813300005234,1000,0.11764705882352941,0.04,0.05970149253731343,0.7272727272727273,0.24,0.3609022556390977,0.21507760532150777,0.97,0.35208711433756806,0.0,0.0,0.0,0.14893617021276595,0.21,0.17427385892116182,0.1927710843373494,0.48,0.27507163323782235,0.0,0.0,0.0,0.0,0.0,0.0,0.47058823529411764,0.16,0.23880597014925373,0.14814814814814814,0.08,0.1038961038961039,,7.92314453125,3.633,355.378,72.105,70.797,48.9704398,0.02498305120001164,5.0,1.0
clahe_split_merge,0.162,0.15953558635804616,0.162,0.09259780587484852,0.09259780587484852,0,0.0,0.3002403779000233,1000,0.06944444444444445,0.05,0.05813953488372093,0.2857142857142857,0.02,0.037383177570093455,0.16556291390728478,1.0,0.2840909090909091,0.0,0.0,0.0,0.1592356687898089,0.25,0.19455252918287938,0.1826086956521739,0.21,0.19534883720930232,0.0,0.0,0.0,0.3333333333333333,0.02,0.03773584905660377,0.3125,0.05,0.08620689655172414,0.08695652173913043,0.02,0.032520325203252036,,2.9447998046875,6.526,4060.285,3970.012,60.885,164.0543644,0.06952815750009174,0.0,0.0

README.md

### Resultados generales

- Accuracy: **31.3 %**
- Precision macro: **0.3439**
- Recall macro: **0.3130**
- F1 macro: **0.2472**
- Respuestas inválidas: **0**

### 7.6. Limitaciones

La exactitud máxima de 31.3 % indica que el desempeño del modelo base sigue siendo limitado para esta tarea especializada.

## 13. Conclusiones preliminares

**CLAHE + Otsu presentó el mejor resultado global**, alcanzando un F1 macro de 0.2472 y una exactitud de 31.3 %, frente a un F1 macro de 0.2202 y una exactitud de 28.2 % con imágenes originales.